{
  "$schema": "http://json-schema.org/draft-04/schema#",

    "type": "object",
    "properties": {
      "employeeId": {
        "type": "integer"
      },
      "forename": {
        "type": "string"
      },
      "surname": {
        "type": "string"
      },
      "email": {
        "type": "string",
        "format": "email",
        "description": "email description"
      },
      "position": {
        "type": "integer",
        "minimum": 0,
        "maximum": 2
      }
    },
    "required": [
      "employeeId",
      "forename",
      "surname",
      "email",
      "position"
    ]
  


}